{
  "schema_version": "1.0",
  "generated_at": "2026-10-11T21:53:27.786529Z",
  "generator": {
    "name": "tool-github-export",
    "version": "0.1.0"
  },
  "sources": [
    {
      "type": "organization",
      "login": "DevArtsLab"
    },
    {
      "type": "user",
      "login": "AmirhosseinOlyaei"
    }
  ],
  "stats": {
    "total": 117,
    "public": 117,
    "private": 0,
    "by_category": {
      "tool": 5,
      "org-infra": 3,
      "project": 109
    }
  },
  "repositories": [
    {
      "name": "tool-github-export",
      "full_name": "DevArtsLab/tool-github-export",
      "owner": "DevArtsLab",
      "owner_type": "Organization",
      "display_name": "GitHub Export",
      "description": "Export GitHub repository metadata to versioned JSON for downstream consumers (directory, portfolio, resume builder)",
      "url": "https://github.com/DevArtsLab/tool-github-export",
      "visibility": "public",
      "category": "tool",
      "featured": true,
      "tags": [
        "cli",
        "developer-tools",
        "github-api",
        "graphql",
        "json",
        "python",
        "tool"
      ],
      "primary_language": "Python",
      "languages": [
        {
          "name": "Python",
          "color": "#3572A5",
          "bytes": 31772,
          "percentage": 59.98
        },
        {
          "name": "TypeScript",
          "color": "#3178c6",
          "bytes": 21201,
          "percentage": 40.02
        }
      ],
      "license": "MIT",
      "stars": 1,
      "forks": 0,
      "watchers": 0,
      "open_issues": 0,
      "size_kb": 135,
      "is_fork": false,
      "is_archived": false,
      "is_template": false,
      "default_branch": "main",
      "created_at": "2026-10-03T23:50:19Z",
      "updated_at": "2026-10-11T12:42:28Z",
      "pushed_at": "2026-10-11T12:42:24Z",
      "image_url": "https://opengraph.githubassets.com/f9c9f298cc653becc678a97eefdeeac455107d812177c7de90b0d5f375266523/DevArtsLab/tool-github-export"
    },
    {
      "name": "devartslab-site",
      "full_name": "DevArtsLab/devartslab-site",
      "owner": "DevArtsLab",
      "owner_type": "Organization",
      "display_name": "Devartslab Site",
      "description": "DevArts Lab landing page on devartslab.com - Cloudflare Workers",
      "url": "https://github.com/DevArtsLab/devartslab-site",
      "homepage": "https://devartslab.com",
      "visibility": "public",
      "category": "org-infra",
      "featured": false,
      "tags": [
        "cloudflare-workers",
        "landing-page"
      ],
      "primary_language": "TypeScript",
      "languages": [
        {
          "name": "TypeScript",
          "color": "#3178c6",
          "bytes": 5440,
          "percentage": 100.0
        }
      ],
      "license": "Apache-2.0",
      "stars": 1,
      "forks": 0,
      "watchers": 0,
      "open_issues": 0,
      "size_kb": 88,
      "is_fork": false,
      "is_archived": false,
      "is_template": false,
      "default_branch": "main",
      "created_at": "2026-10-01T02:08:10Z",
      "updated_at": "2026-10-11T03:55:06Z",
      "pushed_at": "2026-10-11T03:55:03Z",
      "image_url": "https://opengraph.githubassets.com/6269c9a80010e6e52fce763f4112cdd75e3c8a2261b85667c27d1fc06c9bc3c8/DevArtsLab/devartslab-site"
    },
    {
      "name": "tool-github-actions-audit",
      "full_name": "DevArtsLab/tool-github-actions-audit",
      "owner": "DevArtsLab",
      "owner_type": "Organization",
      "display_name": "Tool Github Actions Audit",
      "description": "Interactive CLI auditor for GitHub Actions usage across a user or org account. Finds minute-eating forks and stale scheduled workflows, surfaces branches, events, and external effects, then selectively disables workflows or whole-repo Actions via the API - no commits, confirmation required for every change.",
      "url": "https://github.com/DevArtsLab/tool-github-actions-audit",
      "visibility": "public",
      "category": "tool",
      "featured": false,
      "tags": [
        "audit",
        "cli",
        "devops-tools",
        "gh-cli",
        "github-actions",
        "python"
      ],
      "primary_language": "Python",
      "languages": [
        {
          "name": "Python",
          "color": "#3572A5",
          "bytes": 40460,
          "percentage": 100.0
        }
      ],
      "stars": 1,
      "forks": 0,
      "watchers": 0,
      "open_issues": 0,
      "size_kb": 42,
      "is_fork": false,
      "is_archived": false,
      "is_template": false,
      "default_branch": "master",
      "created_at": "2026-10-10T03:22:19Z",
      "updated_at": "2026-10-11T07:08:21Z",
      "pushed_at": "2026-10-10T22:29:38Z",
      "image_url": "https://opengraph.githubassets.com/2d364827390c3e2d57c4afc56edb5d8224c70d7d569f8533428a3fa25785a066/DevArtsLab/tool-github-actions-audit"
    },
    {
      "name": "node-express-course",
      "full_name": "AmirhosseinOlyaei/node-express-course",
      "owner": "AmirhosseinOlyaei",
      "owner_type": "User",
      "display_name": "Node Express Course",
      "description": "Node.js and Express course exercises",
      "url": "https://github.com/AmirhosseinOlyaei/node-express-course",
      "visibility": "public",
      "category": "project",
      "featured": false,
      "tags": [
        "course",
        "express",
        "javascript",
        "nodejs"
      ],
      "primary_language": "JavaScript",
      "languages": [
        {
          "name": "JavaScript",
          "color": "#f1e05a",
          "bytes": 1175711,
          "percentage": 63.69
        },
        {
          "name": "HTML",
          "color": "#e34c26",
          "bytes": 559568,
          "percentage": 30.31
        },
        {
          "name": "CSS",
          "color": "#663399",
          "bytes": 110678,
          "percentage": 6.0
        },
        {
          "name": "Procfile",
          "color": "#3B2F63",
          "bytes": 112,
          "percentage": 0.01
        }
      ],
      "stars": 0,
      "forks": 0,
      "watchers": 0,
      "open_issues": 0,
      "size_kb": 54015,
      "is_fork": true,
      "is_archived": false,
      "is_template": false,
      "forked_from": "Code-the-Dream-School/node-express-course",
      "default_branch": "main",
      "created_at": "2024-02-24T01:16:12Z",
      "updated_at": "2026-10-08T08:14:31Z",
      "pushed_at": "2026-10-08T08:14:16Z",
      "image_url": "https://opengraph.githubassets.com/be94f307781d94e614ad1011d108ee5090675d9f9af7aebac06dabe89895470c/AmirhosseinOlyaei/node-express-course"
    },
    {
      "name": "AmirhosseinOlyaei-Portfolio",
      "full_name": "AmirhosseinOlyaei/AmirhosseinOlyaei-Portfolio",
      "owner": "AmirhosseinOlyaei",
      "owner_type": "User",
      "display_name": "Amirhosseinolyaei Portfolio",
      "description": "Starter repository for Fenrir Intro to Programming course",
      "url": "https://github.com/AmirhosseinOlyaei/AmirhosseinOlyaei-Portfolio",
      "homepage": "https://amir-olyaei.vercel.app/",
      "visibility": "public",
      "category": "project",
      "featured": false,
      "tags": [
        "css",
        "html",
        "javascript",
        "portfolio"
      ],
      "primary_language": "HTML",
      "languages": [
        {
          "name": "HTML",
          "color": "#e34c26",
          "bytes": 21570,
          "percentage": 48.88
        },
        {
          "name": "JavaScript",
          "color": "#f1e05a",
          "bytes": 16483,
          "percentage": 37.36
        },
        {
          "name": "CSS",
          "color": "#663399",
          "bytes": 6072,
          "percentage": 13.76
        }
      ],
      "stars": 0,
      "forks": 0,
      "watchers": 0,
      "open_issues": 0,
      "size_kb": 7104,
      "is_fork": true,
      "is_archived": false,
      "is_template": false,
      "forked_from": "Code-the-Dream-School/fenrir-intro",
      "default_branch": "main",
      "created_at": "2023-05-17T05:53:54Z",
      "updated_at": "2026-10-08T08:14:19Z",
      "pushed_at": "2026-10-08T08:14:15Z",
      "image_url": "https://opengraph.githubassets.com/d76be82003c37d45edf9b7206b6514e62960eccd78008bbdfb078af87c6dfaa2/AmirhosseinOlyaei/AmirhosseinOlyaei-Portfolio"
    },
    {
      "name": "w3schools-test.github.io",
      "full_name": "AmirhosseinOlyaei/w3schools-test.github.io",
      "owner": "AmirhosseinOlyaei",
      "owner_type": "User",
      "display_name": "W3Schools Test.Github.Io",
      "description": "w3schools.com repository used in demonstrating GitHub and GitHub pages",
      "url": "https://github.com/AmirhosseinOlyaei/w3schools-test.github.io",
      "visibility": "public",
      "category": "project",
      "featured": false,
      "tags": [
        "github-pages",
        "html",
        "tutorial"
      ],
      "primary_language": "HTML",
      "languages": [
        {
          "name": "HTML",
          "color": "#e34c26",
          "bytes": 176893,
          "percentage": 100.0
        }
      ],
      "stars": 0,
      "forks": 0,
      "watchers": 0,
      "open_issues": 0,
      "size_kb": 1600,
      "is_fork": true,
      "is_archived": false,
      "is_template": false,
      "forked_from": "w3schools-test/w3schools-test.github.io",
      "default_branch": "master",
      "created_at": "2022-11-30T07:29:35Z",
      "updated_at": "2026-10-08T08:14:53Z",
      "pushed_at": "2026-10-08T08:14:14Z",
      "image_url": "https://opengraph.githubassets.com/7cc90fd106d44b4266daa79b29d69616d38d7ae3c55a99d81eb7dd5b8d324d00/AmirhosseinOlyaei/w3schools-test.github.io"
    },
    {
      "name": "Precourse",
      "full_name": "AmirhosseinOlyaei/Precourse",
      "owner": "AmirhosseinOlyaei",
      "owner_type": "User",
      "display_name": "Precourse",
      "description": "This repo contains the instruction material and assignments for Lambda School's pre-course program.",
      "url": "https://github.com/AmirhosseinOlyaei/Precourse",